{
  "schemaVersion": "1.1.0",
  "packId": "READINESS-PACK-KAP-OPERATIONAL-CANDIDATE-2026-v1",
  "projectId": "PROJECT-KAP-OPENING-2026",
  "eventId": "EVENT-KAP-OPENING-2026",
  "venueId": "VENUE-KAP-001",
  "generatedAt": "2026-07-29T16:06:13+03:00",
  "missingAuthorities": [
    "AUTH-KAP-CLIENT-OPERATIONAL-ACCEPTANCE",
    "AUTH-KAP-ENGINEERING",
    "AUTH-KAP-EVIDENCE-VERIFICATION",
    "AUTH-KAP-HSE",
    "AUTH-KAP-INTERNAL-OPERATIONAL-APPROVAL",
    "AUTH-KAP-OPENING",
    "AUTH-KAP-READINESS-PACK-ACTIVATION",
    "AUTH-KAP-REQUIREMENT-DENOMINATOR",
    "AUTH-KAP-ROUTE"
  ],
  "missingOwners": [
    "REQ-KAP-ASSIGN-EXECUTION-CONFLICT",
    "REQ-KAP-SCOPE-SITE-DELIVERY-CLOSURE"
  ],
  "missingEvidenceRules": [
    "REQ-KAP-ASSIGN-CONTENT-IBRAHIM",
    "REQ-KAP-ASSIGN-EXECUTION-CONFLICT",
    "REQ-KAP-ASSIGN-OPERATIONS-MAJED",
    "REQ-KAP-CAD-WORKING-SOURCE",
    "REQ-KAP-GOV-COMMUNICATION-REPORTING",
    "REQ-KAP-GOV-ESCALATION-LEVELS",
    "REQ-KAP-SCOPE-OFFICIAL-OPENING-PATH",
    "REQ-KAP-SCOPE-PERMITS-RISK-SAFETY",
    "REQ-KAP-SCOPE-SITE-DELIVERY-CLOSURE",
    "REQ-KAP-SCOPE-TECHNICAL-ARTISTIC-SHOWS",
    "REQ-KAP-SCOPE-TRANSPORT-TOURS-MEDIA",
    "REQ-KAP-WORKSTREAM-GUEST-EXPERIENCE",
    "REQ-KAP-WORKSTREAM-HOSPITALITY"
  ],
  "missingVerificationRules": [
    "REQ-KAP-ASSIGN-CONTENT-IBRAHIM",
    "REQ-KAP-ASSIGN-EXECUTION-CONFLICT",
    "REQ-KAP-ASSIGN-OPERATIONS-MAJED",
    "REQ-KAP-CAD-WORKING-SOURCE",
    "REQ-KAP-GOV-COMMUNICATION-REPORTING",
    "REQ-KAP-GOV-ESCALATION-LEVELS",
    "REQ-KAP-SCOPE-OFFICIAL-OPENING-PATH",
    "REQ-KAP-SCOPE-PERMITS-RISK-SAFETY",
    "REQ-KAP-SCOPE-SITE-DELIVERY-CLOSURE",
    "REQ-KAP-SCOPE-TECHNICAL-ARTISTIC-SHOWS",
    "REQ-KAP-SCOPE-TRANSPORT-TOURS-MEDIA",
    "REQ-KAP-WORKSTREAM-GUEST-EXPERIENCE",
    "REQ-KAP-WORKSTREAM-HOSPITALITY"
  ],
  "missingApprovalRules": [
    "REQ-KAP-ASSIGN-CONTENT-IBRAHIM",
    "REQ-KAP-ASSIGN-EXECUTION-CONFLICT",
    "REQ-KAP-ASSIGN-OPERATIONS-MAJED",
    "REQ-KAP-CAD-WORKING-SOURCE",
    "REQ-KAP-GOV-COMMUNICATION-REPORTING",
    "REQ-KAP-GOV-ESCALATION-LEVELS",
    "REQ-KAP-SCOPE-OFFICIAL-OPENING-PATH",
    "REQ-KAP-SCOPE-PERMITS-RISK-SAFETY",
    "REQ-KAP-SCOPE-SITE-DELIVERY-CLOSURE",
    "REQ-KAP-SCOPE-TECHNICAL-ARTISTIC-SHOWS",
    "REQ-KAP-SCOPE-TRANSPORT-TOURS-MEDIA",
    "REQ-KAP-WORKSTREAM-GUEST-EXPERIENCE",
    "REQ-KAP-WORKSTREAM-HOSPITALITY"
  ],
  "missingSpatialMappings": [
    "REQ-KAP-ASSIGN-CONTENT-IBRAHIM",
    "REQ-KAP-ASSIGN-EXECUTION-CONFLICT",
    "REQ-KAP-ASSIGN-OPERATIONS-MAJED",
    "REQ-KAP-GOV-CHANGE-CONTROL",
    "REQ-KAP-GOV-COMMUNICATION-REPORTING",
    "REQ-KAP-GOV-DECISION-VERSION-REGISTER",
    "REQ-KAP-GOV-ESCALATION-LEVELS",
    "REQ-KAP-GOV-FIVE-STAGE-APPROVAL",
    "REQ-KAP-GOV-STRATEGIC-OBJECTIVE",
    "REQ-KAP-SCOPE-CREATIVE-CONCEPT",
    "REQ-KAP-SCOPE-OFFICIAL-OPENING-PATH",
    "REQ-KAP-SCOPE-PERMITS-RISK-SAFETY",
    "REQ-KAP-SCOPE-SITE-DELIVERY-CLOSURE",
    "REQ-KAP-SCOPE-TECHNICAL-ARTISTIC-SHOWS"
  ],
  "governanceGaps": [
    {
      "gapId": "GAP-KAP-COMMUNICATION-RECORD-OWNER",
      "labelAr": "مالك سجل الاتصال والمخاطبات غير معيّن",
      "category": "communication",
      "classification": "missing",
      "sourceTraceIds": [
        "TRACE-KAP-GOV-COMMS-S9",
        "TRACE-KAP-GOV-DECISIONS-S4-S11"
      ],
      "affectedIds": [
        "POLICY-KAP-COMMUNICATION-RECORD"
      ],
      "impactAr": "توجد قنوات وتقارير دون مالك قانوني شامل لسجل الاتصال.",
      "nextActionAr": "تعيين حافظ سجل الاتصال وسياسة الاحتفاظ."
    },
    {
      "gapId": "GAP-KAP-DECISION-FORUM-DEFINITION",
      "labelAr": "تعريف اللجان ومنتديات القرار مفقود",
      "category": "governance",
      "classification": "missing",
      "sourceTraceIds": [
        "TRACE-KAP-GOV-DECISIONS-S4-S11",
        "TRACE-KAP-GOV-COMMS-S9"
      ],
      "affectedIds": [
        "POLICY-KAP-DECISION-FORUM"
      ],
      "impactAr": "توجد سجلات واجتماعات دون تعريف لجنة القرار ونصابها وصلاحياتها.",
      "nextActionAr": "تعريف منتديات القرار والعضوية والنصاب."
    },
    {
      "gapId": "GAP-KAP-DELEGATION-ABSENCE-RULES",
      "labelAr": "قواعد التفويض والغياب مفقودة",
      "category": "governance",
      "classification": "missing",
      "sourceTraceIds": [
        "TRACE-KAP-GOV-ORG-ROSTER-S3-S5-23",
        "TRACE-KAP-GOV-APPROVAL-S5-T1-R4-6"
      ],
      "affectedIds": [
        "POLICY-KAP-DELEGATION"
      ],
      "impactAr": "الأدوار مسماة دون بديل مخول عند الغياب أو انتهاء التفويض.",
      "nextActionAr": "تعريف التفويض والبديل وفترة الصلاحية."
    },
    {
      "gapId": "GAP-KAP-DOCUMENT-CONTROL-METADATA",
      "labelAr": "بيانات ضبط الوثائق غير مكتملة",
      "category": "document-control",
      "classification": "missing",
      "sourceTraceIds": [
        "TRACE-KAP-GOV-DECISIONS-S4-S11"
      ],
      "affectedIds": [
        "POLICY-KAP-DOCUMENT-CONTROL"
      ],
      "impactAr": "المصدر يطلب رقمًا وسجلًا دون مخطط كامل للإصدار والحافظ والاحتفاظ.",
      "nextActionAr": "اعتماد عقد ضبط الوثائق والإصدارات والاحتفاظ."
    },
    {
      "gapId": "GAP-KAP-HSE-OPERATIONAL-OWNER",
      "labelAr": "مالك السلامة وHSE التشغيلي غير معيّن",
      "category": "ownership",
      "classification": "missing",
      "sourceTraceIds": [
        "TRACE-KAP-GOV-SCOPE-SAFETY-S2-S8",
        "TRACE-KAP-GOV-ORG-ROSTER-S3-S5-23"
      ],
      "affectedIds": [
        "AUTH-KAP-HSE"
      ],
      "impactAr": "وجود السلامة في النطاق لا يحدد مالكًا تشغيليًا أو جهة اعتماد.",
      "nextActionAr": "تعيين مالك وسلطة HSE بمرجع رسمي."
    },
    {
      "gapId": "GAP-KAP-MEDIA-WORKSTREAM-OWNER",
      "labelAr": "مالك مسار الإعلام غير معيّن",
      "category": "ownership",
      "classification": "missing",
      "sourceTraceIds": [
        "TRACE-KAP-GOV-SCOPE-TRANSPORT-MEDIA-S2-S8",
        "TRACE-KAP-GOV-WORKSTREAMS-S7-T1-R3-10"
      ],
      "affectedIds": [
        "WORKSTREAM-KAP-MEDIA"
      ],
      "impactAr": "الإعلام مذكور في النطاق ولا يظهر له مسار ملكية مستقل في جدول المسارات.",
      "nextActionAr": "تعريف مسار الإعلام ومالكه أو توثيق دمجه بسلطة مخولة."
    },
    {
      "gapId": "GAP-KAP-OPERATIONAL-ACCEPTANCE-CRITERIA",
      "labelAr": "معايير القبول التشغيلي مفقودة",
      "category": "acceptance",
      "classification": "missing",
      "sourceTraceIds": [
        "TRACE-KAP-GOV-APPROVAL-S4-S3-7",
        "TRACE-KAP-GOV-APPROVAL-S5-T1-R4-6",
        "TRACE-KAP-GOV-APPROVAL-S6-T1-R2-9"
      ],
      "affectedIds": [
        "AUTH-KAP-CLIENT-OPERATIONAL-ACCEPTANCE"
      ],
      "impactAr": "اعتماد التسليمات لا يحدد قبولًا تشغيليًا أو قرار افتتاح.",
      "nextActionAr": "تعريف معايير القبول والجهة المخولة."
    },
    {
      "gapId": "GAP-KAP-TECHNICAL-SITE-HANDOVER-OWNER",
      "labelAr": "مالك التسليم التقني للموقع غير معيّن",
      "category": "ownership",
      "classification": "missing",
      "sourceTraceIds": [
        "TRACE-KAP-GOV-SCOPE-CLOSURE-S2-S8",
        "TRACE-KAP-GOV-ORG-ROSTER-S3-S5-23"
      ],
      "affectedIds": [
        "WORKSTREAM-KAP-SITE-HANDOVER"
      ],
      "impactAr": "التسليم والإغلاق في النطاق دون مالك تقني محدد.",
      "nextActionAr": "تعيين مالك التسليم الفني ومعايير الاستلام."
    }
  ],
  "unresolvedConflicts": [
    {
      "conflictId": "CONFLICT-KAP-APPROVAL-AUTHORITY-SCOPE",
      "labelAr": "غموض نطاق سلطة الاعتماد",
      "classification": "conflicting",
      "sourceTraceIds": [
        "TRACE-KAP-GOV-APPROVAL-S4-S3-7",
        "TRACE-KAP-GOV-APPROVAL-S5-T1-R4-6",
        "TRACE-KAP-GOV-APPROVAL-S6-T1-R2-9",
        "TRACE-KAP-GOV-COMMS-S9"
      ],
      "affectedIds": [
        "AUTH-KAP-CLIENT-OPERATIONAL-ACCEPTANCE",
        "AUTH-KAP-INTERNAL-OPERATIONAL-APPROVAL"
      ],
      "resolutionStatus": "unresolved",
      "requiredAuthorityKind": "internal-approval",
      "candidateAssignments": [],
      "authorizedResolverAuthorityId": null,
      "derivedFromAssertionIds": [
        "ASSERT-KAP-APPROVAL-S4",
        "ASSERT-KAP-APPROVAL-S5",
        "ASSERT-KAP-APPROVAL-S6",
        "ASSERT-KAP-APPROVAL-S9"
      ]
    },
    {
      "conflictId": "CONFLICT-KAP-ESCALATION-TIMING",
      "labelAr": "تعارض توقيت التصعيد والتغيير",
      "classification": "conflicting",
      "sourceTraceIds": [
        "TRACE-KAP-GOV-ESCALATION-S4-S9-12",
        "TRACE-KAP-GOV-ESCALATION-S8-S3-19"
      ],
      "affectedIds": [
        "POLICY-KAP-ESCALATION"
      ],
      "resolutionStatus": "unresolved",
      "requiredAuthorityKind": "project-assignment",
      "candidateAssignments": [],
      "authorizedResolverAuthorityId": null,
      "derivedFromAssertionIds": [
        "ASSERT-KAP-ESCALATION-S4-IMMEDIATE-24",
        "ASSERT-KAP-ESCALATION-S8-48-IMMEDIATE"
      ]
    },
    {
      "conflictId": "CONFLICT-KAP-EXECUTION-ASSIGNMENT",
      "labelAr": "تعارض تعيين مسؤول التنفيذ",
      "classification": "conflicting",
      "sourceTraceIds": [
        "TRACE-KAP-GOV-EXECUTION-S3-S19",
        "TRACE-KAP-GOV-EXECUTION-S7-T1-R8"
      ],
      "affectedIds": [
        "ACTOR-KAP-JOSEPH-HADDAD",
        "ACTOR-KAP-MUHAMMAD-IBRAHIM",
        "AUTH-KAP-RESPONSIBLE-DELIVERY",
        "REQ-KAP-ASSIGN-EXECUTION-CONFLICT",
        "WORKSTREAM-KAP-EXECUTION"
      ],
      "resolutionStatus": "unresolved",
      "requiredAuthorityKind": "project-assignment",
      "candidateAssignments": [
        {
          "candidateId": "ASSERT-KAP-EXECUTION-MUHAMMAD-S3",
          "actor": {
            "actorRef": "ACTOR-KAP-MUHAMMAD-IBRAHIM",
            "displayNameAr": "محمد إبراهيم",
            "actorType": "person",
            "classification": "conflicting",
            "sourceTraceIds": [
              "TRACE-KAP-FOUNDER-MUHAMMAD",
              "TRACE-KAP-GOV-EXECUTION-S3-S19",
              "TRACE-KAP-EMPLOYEE-MUHAMMAD-R28"
            ],
            "founderDirectionReference": "TRACE-KAP-FOUNDER-MUHAMMAD",
            "assignmentScope": "مرشح ممثل مشروع في المخطط التنظيمي، غير محسوم لمسار التنفيذ",
            "authorityLimitations": [